{
  "schemaVersion": "1.0",
  "exportId": "export_case_000421_thread",
  "caseId": "case_000421",
  "caseNumber": "C01-7K4M2Q-0702-1000",
  "checkpoint": "423456789012345680",
  "attachments": [
    {
      "messageId": "msg_000421_c",
      "attachmentId": "attachment_graph_a",
      "filename": "fictional-limit-sketch.png",
      "mediaType": "image/png",
      "sizeBytes": 2048,
      "sha256": "aaaaaaaaaaaaaaaaaaaaaaaaaaaaaaaaaaaaaaaaaaaaaaaaaaaaaaaaaaaaaaaa"
    }
  ]
}
